[
  {
    "metric_run_id": "run-33:cohort_install_count",
    "metric_name": "cohort_install_count",
    "metric_definition_version": "0.3.0",
    "input_snapshot_id": "5c687736211b97ce8690c23c47d5a0923ca5891dc329d85942d3610e68bff4dc",
    "input_received_at_watermark": "2026-08-09T00:00:00.000Z",
    "input_ledger_position": "2026-08-08T00:00:01.000Z|session-33-d7",
    "computed_at": "2026-08-09T00:01:00.000Z",
    "data_freshness": "complete",
    "aggregation_time_zone": "UTC",
    "rule_bundle_id": "metric-stage-b",
    "rule_bundle_version": "0.3.0",
    "rule_bundle_hash": "2222222222222222222222222222222222222222222222222222222222222222",
    "rounding_mode": "half_even",
    "reproducibility_status": "fully_reproducible",
    "value_type": "count",
    "value_unscaled": "1",
    "grouping": {
      "dimensions": {
        "campaign_id": "provider-campaign-33",
        "network": "synthetic-network",
        "country": "JP",
        "cohort_date": "2026-08-01"
      },
      "dimension_digest": "4fe1dbaf005f7b62b1a2bfce92ae6894455962c990cf352438a51a67f8de4915"
    },
    "evidence_refs": [
      {
        "tenant_id": "tenant-a",
        "app_id": "app-a",
        "ref": "ad-view-33",
        "lifecycle_status": "available",
        "access_class": "protected"
      },
      {
        "tenant_id": "tenant-a",
        "app_id": "app-a",
        "ref": "aggregate-revenue-33",
        "lifecycle_status": "available",
        "access_class": "protected"
      },
      {
        "tenant_id": "tenant-a",
        "app_id": "app-a",
        "ref": "click-33",
        "lifecycle_status": "available",
        "access_class": "protected"
      },
      {
        "tenant_id": "tenant-a",
        "app_id": "app-a",
        "ref": "cost-33",
        "lifecycle_status": "available",
        "access_class": "protected"
      },
      {
        "tenant_id": "tenant-a",
        "app_id": "app-a",
        "ref": "install-33",
        "lifecycle_status": "available",
        "access_class": "protected"
      },
      {
        "tenant_id": "tenant-a",
        "app_id": "app-a",
        "ref": "revenue-33-a",
        "lifecycle_status": "available",
        "access_class": "protected"
      },
      {
        "tenant_id": "tenant-a",
        "app_id": "app-a",
        "ref": "revenue-33-b",
        "lifecycle_status": "available",
        "access_class": "protected"
      },
      {
        "tenant_id": "tenant-a",
        "app_id": "app-a",
        "ref": "revenue-33-c",
        "lifecycle_status": "available",
        "access_class": "protected"
      },
      {
        "tenant_id": "tenant-a",
        "app_id": "app-a",
        "ref": "session-33-d1",
        "lifecycle_status": "available",
        "access_class": "protected"
      },
      {
        "tenant_id": "tenant-a",
        "app_id": "app-a",
        "ref": "session-33-d7",
        "lifecycle_status": "available",
        "access_class": "protected"
      }
    ]
  },
  {
    "metric_run_id": "run-33:cohort_ltv_d7_usd",
    "metric_name": "cohort_ltv_d7_usd",
    "metric_definition_version": "0.3.0",
    "input_snapshot_id": "5c687736211b97ce8690c23c47d5a0923ca5891dc329d85942d3610e68bff4dc",
    "input_received_at_watermark": "2026-08-09T00:00:00.000Z",
    "input_ledger_position": "2026-08-08T00:00:01.000Z|session-33-d7",
    "computed_at": "2026-08-09T00:01:00.000Z",
    "data_freshness": "complete",
    "aggregation_time_zone": "UTC",
    "rule_bundle_id": "metric-stage-b",
    "rule_bundle_version": "0.3.0",
    "rule_bundle_hash": "2222222222222222222222222222222222222222222222222222222222222222",
    "rounding_mode": "half_even",
    "reproducibility_status": "fully_reproducible",
    "value_type": "money",
    "value_unscaled": "150000000",
    "fx_rate_unscaled": "5",
    "fx_rate_scale": 1,
    "fx_rate_source": "synthetic-fixture-rate",
    "fx_rate_as_of": "2026-08-01T00:00:00.000Z",
    "fx_rate_snapshot_id": "1e4819c8668a2960af272ad149d7630d78f74d00977e35f7e42f2d1ed337da29",
    "fx_policy_version": "fx-stage-b-v0.2",
    "amount_scale": 6,
    "currency": "USD",
    "grouping": {
      "dimensions": {
        "campaign_id": "provider-campaign-33",
        "network": "synthetic-network",
        "country": "JP",
        "cohort_date": "2026-08-01"
      },
      "dimension_digest": "4fe1dbaf005f7b62b1a2bfce92ae6894455962c990cf352438a51a67f8de4915"
    },
    "evidence_refs": [
      {
        "tenant_id": "tenant-a",
        "app_id": "app-a",
        "ref": "ad-view-33",
        "lifecycle_status": "available",
        "access_class": "protected"
      },
      {
        "tenant_id": "tenant-a",
        "app_id": "app-a",
        "ref": "aggregate-revenue-33",
        "lifecycle_status": "available",
        "access_class": "protected"
      },
      {
        "tenant_id": "tenant-a",
        "app_id": "app-a",
        "ref": "click-33",
        "lifecycle_status": "available",
        "access_class": "protected"
      },
      {
        "tenant_id": "tenant-a",
        "app_id": "app-a",
        "ref": "cost-33",
        "lifecycle_status": "available",
        "access_class": "protected"
      },
      {
        "tenant_id": "tenant-a",
        "app_id": "app-a",
        "ref": "install-33",
        "lifecycle_status": "available",
        "access_class": "protected"
      },
      {
        "tenant_id": "tenant-a",
        "app_id": "app-a",
        "ref": "revenue-33-a",
        "lifecycle_status": "available",
        "access_class": "protected"
      },
      {
        "tenant_id": "tenant-a",
        "app_id": "app-a",
        "ref": "revenue-33-b",
        "lifecycle_status": "available",
        "access_class": "protected"
      },
      {
        "tenant_id": "tenant-a",
        "app_id": "app-a",
        "ref": "revenue-33-c",
        "lifecycle_status": "available",
        "access_class": "protected"
      },
      {
        "tenant_id": "tenant-a",
        "app_id": "app-a",
        "ref": "session-33-d1",
        "lifecycle_status": "available",
        "access_class": "protected"
      },
      {
        "tenant_id": "tenant-a",
        "app_id": "app-a",
        "ref": "session-33-d7",
        "lifecycle_status": "available",
        "access_class": "protected"
      }
    ]
  },
  {
    "metric_run_id": "run-33:d1_roas",
    "metric_name": "d1_roas",
    "metric_definition_version": "0.3.0",
    "input_snapshot_id": "5c687736211b97ce8690c23c47d5a0923ca5891dc329d85942d3610e68bff4dc",
    "input_received_at_watermark": "2026-08-09T00:00:00.000Z",
    "input_ledger_position": "2026-08-08T00:00:01.000Z|session-33-d7",
    "computed_at": "2026-08-09T00:01:00.000Z",
    "data_freshness": "complete",
    "aggregation_time_zone": "UTC",
    "rule_bundle_id": "metric-stage-b",
    "rule_bundle_version": "0.3.0",
    "rule_bundle_hash": "2222222222222222222222222222222222222222222222222222222222222222",
    "rounding_mode": "half_even",
    "reproducibility_status": "fully_reproducible",
    "value_type": "ratio",
    "value_unscaled": "500000",
    "ratio_scale": 6,
    "grouping": {
      "dimensions": {
        "campaign_id": "provider-campaign-33",
        "network": "synthetic-network",
        "country": "JP",
        "cohort_date": "2026-08-01"
      },
      "dimension_digest": "4fe1dbaf005f7b62b1a2bfce92ae6894455962c990cf352438a51a67f8de4915"
    },
    "evidence_refs": [
      {
        "tenant_id": "tenant-a",
        "app_id": "app-a",
        "ref": "ad-view-33",
        "lifecycle_status": "available",
        "access_class": "protected"
      },
      {
        "tenant_id": "tenant-a",
        "app_id": "app-a",
        "ref": "aggregate-revenue-33",
        "lifecycle_status": "available",
        "access_class": "protected"
      },
      {
        "tenant_id": "tenant-a",
        "app_id": "app-a",
        "ref": "click-33",
        "lifecycle_status": "available",
        "access_class": "protected"
      },
      {
        "tenant_id": "tenant-a",
        "app_id": "app-a",
        "ref": "cost-33",
        "lifecycle_status": "available",
        "access_class": "protected"
      },
      {
        "tenant_id": "tenant-a",
        "app_id": "app-a",
        "ref": "install-33",
        "lifecycle_status": "available",
        "access_class": "protected"
      },
      {
        "tenant_id": "tenant-a",
        "app_id": "app-a",
        "ref": "revenue-33-a",
        "lifecycle_status": "available",
        "access_class": "protected"
      },
      {
        "tenant_id": "tenant-a",
        "app_id": "app-a",
        "ref": "revenue-33-b",
        "lifecycle_status": "available",
        "access_class": "protected"
      },
      {
        "tenant_id": "tenant-a",
        "app_id": "app-a",
        "ref": "revenue-33-c",
        "lifecycle_status": "available",
        "access_class": "protected"
      },
      {
        "tenant_id": "tenant-a",
        "app_id": "app-a",
        "ref": "session-33-d1",
        "lifecycle_status": "available",
        "access_class": "protected"
      },
      {
        "tenant_id": "tenant-a",
        "app_id": "app-a",
        "ref": "session-33-d7",
        "lifecycle_status": "available",
        "access_class": "protected"
      }
    ]
  },
  {
    "metric_run_id": "run-33:d3_roas",
    "metric_name": "d3_roas",
    "metric_definition_version": "0.3.0",
    "input_snapshot_id": "5c687736211b97ce8690c23c47d5a0923ca5891dc329d85942d3610e68bff4dc",
    "input_received_at_watermark": "2026-08-09T00:00:00.000Z",
    "input_ledger_position": "2026-08-08T00:00:01.000Z|session-33-d7",
    "computed_at": "2026-08-09T00:01:00.000Z",
    "data_freshness": "complete",
    "aggregation_time_zone": "UTC",
    "rule_bundle_id": "metric-stage-b",
    "rule_bundle_version": "0.3.0",
    "rule_bundle_hash": "2222222222222222222222222222222222222222222222222222222222222222",
    "rounding_mode": "half_even",
    "reproducibility_status": "fully_reproducible",
    "value_type": "ratio",